[
  {
    "id": "systems.nintendoor64.starzip",
    "kind": "System",
    "tags": [
      "Nintendoor64",
      "N64",
      "ROM",
      "PackUnpack",
      "BootHook",
      "CLI",
      "Rust"
    ],
    "paths": [
      "crates/starzip-cli/src/lib.rs",
      "crates/starzip-cli/src/main.rs",
      "crates/n64-layout/src/lib.rs",
      "configs/nintendoor64_test.layout.json"
    ],
    "repo": "Doctor0Evil/Nintendoor64",
    "description": "Starzip: Nintendoor64 ROM pack/unpack and boot hook tool. Provides CLI for unpacking logical files, replacing assets, and injecting test patterns or controller hooks into the boot segment for N64-style builds.",
    "depends_on": [],
    "provides": [
      "Nintendoor64.ROM.Pack",
      "Nintendoor64.ROM.Unpack",
      "Nintendoor64.ROM.BootHook"
    ]
  },
  {
    "id": "systems.nintendoor64.sonia",
    "kind": "System",
    "tags": [
      "Nintendoor64",
      "ArtifactSink",
      "CLI",
      "Rust",
      "AIChat",
      "BinarySafe"
    ],
    "paths": [
      "crates/sonia-core/src/lib.rs",
      "crates/sonia-core/src/main.rs"
    ],
    "repo": "Doctor0Evil/Nintendoor64",
    "description": "Sonia core artifact sink: reads JSON ArtifactSpec from stdin, decodes text/hex/base64 content, writes artifacts/*, and reports status for AI-Chat orchestration and CI.",
    "depends_on": [],
    "provides": [
      "Nintendoor64.Artifacts.Write",
      "Nintendoor64.Artifacts.Decode",
      "Nintendoor64.Artifacts.Report"
    ]
  }
]
